{
  "$schema": "https://raw.githubusercontent.com/filip137/nonlinear-drn-paper/main/configs/schema/simulator-v2.schema.json",
  "description": "Default simulator profile for a sampled custom/measured PWL I-V curve.",
  "kind": "simulator_profile",
  "provenance": {
    "materialized_defaults": [
      "simulation.updater.extrapolation",
      "simulation.updater.nonconvergence_policy"
    ],
    "migration": {
      "from_schema_version": 1,
      "to_schema_version": 2,
      "tool": "scripts/migrate_training_configs.py"
    }
  },
  "schema_version": 2,
  "simulation": {
    "amplification": {
      "current_factor": 1.0,
      "voltage_factor": 4.0
    },
    "nonlinearity": "experimental",
    "physical": {
      "representation": "measured_piecewise_linear"
    },
    "updater": {
      "curve": "data/assets/experimental_curve_voff_0.8_200_points.npz",
      "damping": 1.0,
      "extrapolation": "clamp",
      "max_steps": 32,
      "method": "piecewise_linear_newton_v1",
      "nonconvergence_policy": "accept_last",
      "relaxation": 1.0,
      "voltage_tolerance": 0.01
    }
  }
}
